{
  "$schema": "https://json-schema.org/draft/2020-12/schema",
  "title": "army-pool-edge config",
  "description": "One config file drives the whole edge. scripts/lib/config.mjs is the fail-closed enforcement; this schema documents the same contract for editors. Secrets (the upstream pool key) are NEVER config: they are wrangler secrets. Security behavior (sealed prefixes, header hygiene, token weights, probe policy) is NOT configurable.",
  "type": "object",
  "additionalProperties": false,
  "required": ["edgeName", "publicOrigin", "pool", "tiers"],
  "properties": {
    "$schema": { "type": "string" },
    "edgeName": {
      "type": "string",
      "pattern": "^[a-z0-9][a-z0-9-]{0,62}$",
      "description": "Worker name and the `service` value reported by /health. Monitors key on it; pick it once."
    },
    "publicOrigin": {
      "type": "string",
      "format": "uri",
      "description": "The https origin this edge serves (bare origin, no path). Becomes the custom-domain route and PUBLIC_BASE_URL."
    },
    "pool": {
      "type": "object",
      "additionalProperties": false,
      "required": ["baseUrl"],
      "properties": {
        "baseUrl": {
          "type": "string",
          "format": "uri",
          "description": "The upstream pool-meter origin (bare https origin). Rendered into wrangler.toml as UPSTREAM_BASE_URL. Must differ from publicOrigin."
        }
      }
    },
    "cors": {
      "type": "object",
      "additionalProperties": false,
      "properties": {
        "allowedOrigins": {
          "type": "array",
          "items": { "type": "string", "format": "uri" },
          "description": "Browser origins allowed to call the edge (e.g. your army instance site). publicOrigin is always included automatically."
        }
      }
    },
    "tokens": {
      "type": "object",
      "additionalProperties": false,
      "properties": {
        "prefix": {
          "type": "string",
          "pattern": "^[a-z][a-z0-9]{2,15}_$",
          "description": "Prefix for contributor edge tokens. Default army_."
        }
      }
    },
    "tiers": {
      "type": "object",
      "description": "Grant tiers. MUST include `contributor` (the fallback for unknown tier names). `models: null` means unrestricted; a list restricts by model-name prefix.",
      "minProperties": 1,
      "patternProperties": {
        "^[a-z][a-z0-9-]{0,31}$": {
          "type": "object",
          "additionalProperties": false,
          "required": ["weightedTokens", "models"],
          "properties": {
            "weightedTokens": { "type": "integer", "minimum": 1, "maximum": 1000000000000 },
            "models": {
              "oneOf": [
                { "type": "null" },
                { "type": "array", "minItems": 1, "items": { "type": "string", "pattern": "^[a-z0-9.:_-]+$" } }
              ]
            }
          }
        }
      },
      "additionalProperties": false
    },
    "support": {
      "type": "object",
      "additionalProperties": false,
      "properties": {
        "grantIncreaseNote": {
          "type": "string",
          "maxLength": 300,
          "description": "Appended to the 429 grant-exhausted error. Operator-supplied copy."
        }
      }
    },
    "passthroughAssets": {
      "type": "array",
      "items": { "type": "string", "pattern": "^/[A-Za-z0-9._/-]+$" },
      "description": "Extra GET-exact upstream asset paths served anonymously through the edge (e.g. a brand mark the upstream pages reference). Each entry is one exact path, never a prefix."
    },
    "kv": {
      "type": "object",
      "additionalProperties": false,
      "properties": {
        "namespaceId": {
          "type": "string",
          "pattern": "^$|^[0-9a-f]{32}$",
          "description": "Cloudflare KV namespace id (create with `wrangler kv namespace create POOL_EDGE`). Empty until you create it; the render step warns while it is empty."
        }
      }
    }
  }
}
